,Unnamed: 0,Rating,Review Title,Review Body,Label,Combined
0,0,,Excellent,Good👍,0,excel good
1,1,,Wonderful,Very good HD picture quality  of this TV and timely delivery and installation is very systematic process. Thanks for Flipkart & Samsung team related this item.,0,wonder good hd pictur qualiti tv time deliveri instal systemat process thank flipkart samsung team relat item
2,2,,Great product,Nice TV in this price,0,great product nice tv price
3,3,,Highly recommended,Absolutely value for money.,0,high recommend absolut valu
4,4,,Terrific purchase,Good quality at this price. Picture quality is very good. Sound quality is also very good.,0,terrif purchas good qualiti price pictur qualiti good sound qualiti also good
5,5,,Best in the market!,"I m using this tv for the past 10 days..I found that the following Image quality is good,Sound quality is good,Connectivity is good, Overall the product is good to use...Samsung is better than Mi, Redmi and Vu TVs Go for it....",0,best market use tv past daysi found follow imag qualiti goodsound qualiti goodconnect good overal product good usesamsung better mi redmi vu tvs go
6,6,,Excellent,Nice product,0,excel nice product
7,7,,Super!,Good product from samsung,0,super good product samsung
8,8,,Value-for-money,"Value for money.. Pros: Picture quality and different picture modes.Sound quality is beyond expectations.Have all the necessary apps and you can also download them.Smooth interface, not too much lag.Cons:Casting: sometimes picture/video doesn't show while casting.Thick besels in 2020.Overall I would say it's a fantastic product from Samsung. Happy that I didn't buy the cheap Chinese alternatives. Go for it if 32 inch hd ready smart tv is your choice. Loved the product...",0,valueformi valu pros pictur qualiti differ pictur modessound qualiti beyond expectationshav necessari app also download themsmooth interfac much lagconscast sometim picturevideo doesnt show castingthick besel overal would say fantast product samsung happi didnt buy cheap chines altern go inch hd readi smart tv choic love product
9,9,,Perfect product!,Excellent Quality! Excellent Services!,0,perfect product excel qualiti excel servic
10,10,,Just wow!,Great picture quality overall awesome tvSamsung best,0,wow great pictur qualiti overal awesom tvsamsung best
11,11,,Brilliant,Very Good Picture Quality with a decent sound system. You can surely go for this product in this price range. Good delivery by Flipkart.,0,brilliant good pictur qualiti decent sound system sure go product price rang good deliveri flipkart
12,12,,Awesome,Picture and sound quility Super. Awesome Samsung. ExpirenceIs Amazing. Thankyou Flipkart.,0,awesom pictur sound quiliti super awesom samsung expirencei amaz thankyou flipkart
13,13,,Pretty good,When u receive it first thing u do.. just update the tv software.. Change the Sound preferences to amplify..For good picture quality u have to subscribe first HD channels on ur dish..or HD files input required..Normal tv channels burst on screen ..Wireless connectivity is awesome..Power consumption is a bit high as it's rated 2/5.,0,pretti good u receiv first thing u updat tv softwar chang sound prefer amplifyfor good pictur qualiti u subscrib first hd channel ur dishor hd file input requirednorm tv channel burst screen wireless connect awesomepow consumpt bit high rate
14,14,,Great product,Awesome ...no one comparison to this one..I am totally impressed...thanku.samsung..  to make.. this type of television... Nice .. buy...it. don't think... About  to purchase to... Samsung... Nice... I will provide ..5 out 5....,0,great product awesom comparison total impressedthankusamsung make type televis nice buyit dont think purchas samsung nice provid
15,15,,Fabulous!,Nice product from Samsung this my 2nd led tv it's awesome,0,fabul nice product samsung nd led tv awesom
16,16,,Mind-blowing purchase,"I was in hurry to buy and I don't find any Bette deal like this. Samsung has trusted customer value so, I go for it. Actually there are so many options but price difference of 1k to 2k I don't want to take chance for chinese brand. So I opted for this and satisfied. My kid love it and it's compact size fits in my bedroom easily.",0,mindblow purchas hurri buy dont find bett deal like samsung trust custom valu go actual mani option price differ k k dont want take chanc chines brand opt satisfi kid love compact size fit bedroom easili
17,17,,Mind-blowing purchase,I am using this tv from 6 months....picture quality and sound quality is awsm...screen mirrior work perfectly....I use screen mirrior for watching movie and listining music...very nice sound quality...I love this tv,0,mindblow purchas use tv monthspictur qualiti sound qualiti awsmscreen mirrior work perfectlyi use screen mirrior watch movi listin musicveri nice sound qualityi love tv
18,18,,Brilliant,I am satisfied..Picture quality is awesome 😻😎Sound quality is good 🙂Installation work very fastFlipkart service very good 🙂👍Thank u Flipkart 👏,0,brilliant satisfiedpictur qualiti awesom sound qualiti good instal work fastflipkart servic good thank u flipkart
19,19,,Delightful,Very good 👍 tv,0,delight good tv
20,20,,Delightful,"overall is good compare to price, pictures quality is good but not hd intertnet options are also good it affordable and good",0,delight overal good compar price pictur qualiti good hd intertnet option also good afford good
21,21,,Brilliant,Nice one at this price good Samsung 🙏🙏🙏🙏My first Samsung led tv 📺 Befor I always use lg but this time Samsung I’m happy with Samsung led tv great job by Samsung and the Flipkart Thank you 🙏 Flipkart to deliver in this lockdown also little bit late but great work by Flipkart Good luck 😉,0,brilliant nice price good samsung first samsung led tv befor alway use lg time samsung im happi samsung led tv great job samsung flipkart thank flipkart deliv lockdown also littl bit late great work flipkart good luck
22,22,,Value-for-money,Nice smart tv for samsung with this price and installation also very fast within 24 hour's. Thnk u😊😊,0,valueformi nice smart tv samsung price instal also fast within hour thnk u
23,23,,Worth the money,"Go for it Nice 32 inch tv by our old trusted brand SamsungSamsung make TV's from CRT edition to now QLEDAnd then Samsung service any where by their experts was goodOn last I want to say if any one want to buy tv remember this points:*Go for a trusted brand who gave good after sale service  because this was a tv not a mobile which we donot change after 2 or 3 years.*Check ratings from inside like picture, sound, connectivity.*Check online reviews ,video etc",0,worth go nice inch tv old trust brand samsungsamsung make tvs crt edit qledand samsung servic expert goodon last want say want buy tv rememb pointsgo trust brand gave good sale servic tv mobil donot chang yearscheck rate insid like pictur sound connectivitycheck onlin review video etc
24,24,,Must buy!,Good,0,must buy good
25,25,,Worth every penny,Really awesome tv best quality very good sound... Just go for it guys bcz its very bettet than mi TV.  Very low prize best quality tv great and tqq flipkart,0,worth everi penni realli awesom tv best qualiti good sound go guy bcz bettet mi tv low prize best qualiti tv great tqq flipkart
26,26,,Wonderful,Excellent,0,wonder excel
27,27,,Wonderful,"Sound quality not good , picture quality good ,  as this price very very good.",0,wonder sound qualiti good pictur qualiti good price good
28,28,,Terrific,Good tv in this price. sound quality is also good 👍👍,0,terrif good tv price sound qualiti also good
29,29,,Just wow!,"Very nice samsung LED TV , good quality 💖. Best sound quality.❤️Quick mobile support  and  good quality 😍Samsung sarvice is very good 😊. My choice five of one Always Samsung 😊💖❤️",0,wow nice samsung led tv good qualiti best sound qualityquick mobil support good qualiti samsung sarvic good choic five alway samsung
30,30,,Excellent,Very good product also great service from Samsung. I am writing this after 15 days usage. It's a quality product and mirror playing and other connectivity is scoring good number.,0,excel good product also great servic samsung write day usag qualiti product mirror play connect score good number
31,31,,Mind-blowing purchase,Awsm... value for money...good product....fast delivery...and services are fantastic.... thanks flipkart...❤️🤘,0,mindblow purchas awsm valu mygood productfast deliveryand servic fantast thank flipkart
32,32,,Fabulous!,"After watching 3-4 days on this led tv.. I found it good worth of money.. Picture quality is awesome and clear.. Sound is good and not need to connect any other speaker because the output of the TV speakers is enough to enjoy a loud sound experience. Connectivity options are good and quick.. Overall I will recommended it to buy  over Mi, realme and other similar brands..",0,fabul watch day led tv found good worth pictur qualiti awesom clear sound good need connect speaker output tv speaker enough enjoy loud sound experi connect option good quick overal recommend buy mi realm similar brand
33,33,,Excellent,🥰🥰happy,0,excel happi
34,34,,Best in the market!,Very good TVSound and picture quality is bestConnectivity is goodGood service of flipkart,0,best market good tvsound pictur qualiti bestconnect goodgood servic flipkart
35,35,,Perfect product!,It is very nice 😘😘and good colitis 🎆🎇🎆🎉🎊📺📺📺,0,perfect product nice good coliti
36,36,,Good quality product,"Awesome smart tv at this price sound quality and picture is super, connectivity also excellent it have all the smart tv apps just go for it, Best smart tv at this value.And filpkart packing is very good , thank you filpkart for your services.",0,good qualiti product awesom smart tv price sound qualiti pictur super connect also excel smart tv app go best smart tv valueand filpkart pack good thank filpkart servic
37,37,,Very Good,"This is an initial impression. { just 2 days}Delivered before date, and installation done within 3 hrs which is very impressive.Pros1. Value for money2. Useful apps are pre-loaded3. Connectivity is good4. Picture quality is goodCons1. Table stand / walk mount not included in the box. But you have an option to select at the time of installation. Ideally we should get both, but you will get either. { DO NOT PAY ANYTHING FOR TABLE STAND OR WALL MOUNT, ITS FREE FROM SAMSUNG}2. Sound is...",0,good initi impress daysdeliv date instal within hrs impressivepro valu use app preload connect good pictur qualiti goodcon tabl stand walk mount includ box option select time instal ideal get get either pay anyth tabl stand wall mount free samsung sound
38,38,,Wonderful,Good,0,wonder good
39,39,,Good choice,Most amazing tv at amazing price. Right from placing the order to getting installation done everything was smooth. I would like to recommend this tv to everyone.,0,good choic amaz tv amaz price right place order get instal everyth smooth would like recommend tv everi
40,40,,Really Nice,Nice and good,0,realli nice nice good
41,41,,Nice product,Good,0,nice product good
42,42,,Good quality product,"Good Television For Modern Time ,If You Want It Then Go Nd Buy It ,,,👍",0,good qualiti product good televis modern time want go nd buy
43,43,,Delightful,"Pros: Pricing - It comes at a lower price than even a standard smartphone. Picture - Picture quality is good. However, square pixels are clearly seen if looked closely. Sound - In a nutshell, ""Awesome"". Value for money. Pre-installed apps - It has Hotstar, Netflix, YouTube, etc.and few other similar apps built-in. Just switch on your internet and enjoy.Cons: Bluetooth - It lacks bluetooth connectivity which I feel is unbelievable.HD Ready only - Resolution is not that great. But keeping...",0,delight pros price come lower price even standard smartph pictur pictur qualiti good howev squar pixel clear seen look close sound nutshel awesom valu preinstal app hotstar netflix youtub etcand similar app builtin switch internet enjoycon bluetooth lack bluetooth connect feel unbelievablehd readi resolut great keep
44,44,,Simply awesome,Nice tv. Picture and sound quality is good. But there is no table top stand in the box. You have to ask the technician for table top stand if you don't want wall mount. Table top stand is free of cost. Overall good product.,0,simpli awesom nice tv pictur sound qualiti good tabl top stand box ask technician tabl top stand dont want wall mount tabl top stand free cost overal good product
45,45,,Nice product,"Review after 2weeks Am already using Mi 4a Pro for last one year,Comparing with Mi 32inch tv#picture clarity Mi is winner #for Audio clarity samsung is winner, really super soundComming to samsung tvPros Sound is far better than miFast boot and opening is fast - mi tv is delay in boot and switching, app openingUser friendly, helpful for old age peopleBuild is super ConsThick bizelsCable tv picture is not that good.. use set top box for better results",0,nice product review week alreadi use mi pro last yearcompar mi inch tvpictur clariti mi winner audio clariti samsung winner realli super soundcom samsung tvpros sound far better mifast boot open fast mi tv delay boot switch app openingus friend help old age peoplebuild super consthick bizelsc tv pictur good use set top box better result
46,46,,Highly recommended,Good picture good product good sound amazing product thank you Flipkart good delivery,0,high recommend good pictur good product good sound amaz product thank flipkart good deliveri
47,47,,Simply awesome,TV is very  good at price level all features is good but no headphone jack disney Hotstar apps is not available in the home application that's it thank you.,0,simpli awesom tv good price level featur good headph jack disney hotstar app avail home applic that thank
48,48,,Awesome,I am fully satisfied with this product... Great picture quality..,0,awesom fulli satisfi product great pictur qualiti
49,49,,Classy product,Overall good and excellent for this budget price. But one suggestion must send table stand with box,0,classi product overal good excel budget price suggest must send tabl stand box
50,50,,Classy product,Nice TV at this price rang,0,classi product nice tv price rang
51,51,,Value-for-money,Good,0,valueformi good
52,52,,Simply awesome,All should buy this amazing product thanku flipkart 🥰🥰🏆,0,simpli awesom buy amaz product thanku flipkart
53,53,,Worth the money,Go through It !,0,worth go
54,54,,Mind-blowing purchase,Connecting with pc is best ...... Netflix working very better and sound quality is also best .Hd support is very best .....1080 p with youtube is awesomeInstallation done in 2 days,0,mindblow purchas connect pc best netflix work better sound qualiti also best hd support best p youtub awesomeinstal day
55,55,,Perfect product!,Nice product,0,perfect product nice product
56,56,,Wonderful,"Samsung 32 inch smart tv is a good one to buy. Picture quality is very nice. When you are running via internet, bandwidth is the main priority. High bandwidth you can watch best picture. But i am dissatisfied with the sound. Although it has 20watt rms speakers, but sound is average. Bluetooth is unavailable in this model. I think in low budget its the best tv to buy.",0,wonder samsung inch smart tv good buy pictur qualiti nice run via internet bandwidth main prioriti high bandwidth watch best pictur dissatisfi sound although watt rms speaker sound averag bluetooth unavail model think low budget best tv buy
57,57,,Awesome,Just outstanding performance.... Thanks flipkart. This product is very chif and just wow,0,awesom outstand perform thank flipkart product chif wow
58,58,,Highly recommended,Nice LED Smart For Best,0,high recommend nice led smart best
59,59,,Perfect product!,"Very good Tv, Nice picture quality but sound quality not good but overall good....Thank you Flipkart for fast delivery and installation, I'm satisfied for this 🙏👍",0,perfect product good tv nice pictur qualiti sound qualiti good overal goodthank flipkart fast deliveri instal im satisfi
60,60,,Wonderful,Samsung HD led TV nice,0,wonder samsung hd led tv nice
61,61,,Highly recommended,"Wow!!! I am very surprised about it. It is very awesome and nice picture quality and like of Full HD but it is HD. It is Ultra HD + HDR, Deep Colour (True beautiful Colour) I am extremely happy and mind blowing. Thank Flipkart Service. I already giving rating of 5/5 🔥.Picture/Sound/Connect or all are rating of 5/5 🔥🔥🔥",0,high recommend wow surpris awesom nice pictur qualiti like full hd hd ultra hd hdr deep colour true beauti colour extrem happi mind blow thank flipkart servic alreadi give rate picturesoundconnect rate
62,62,,Wonderful,Awesome product by samsung.But installation process is slow this time.,0,wonder awesom product samsungbut instal process slow time
63,63,,Worth every penny,"No laging, Sound quality is better than  others (in 20 w group),picture quality is good but not satisfied ,Value for money,in this price range this tv is better than other  Chinese brand like MI,realme ,one plus and  extras....!I give 4.2 stars.",0,worth everi penni lage sound qualiti better other w grouppictur qualiti good satisfi valu myin price rang tv better chines brand like mirealm plus extrasi give star
64,64,,Great product,"Amazing product,i,am happy ????",0,great product amaz productiam happi
65,65,,Terrific,Good,0,terrif good
66,66,,Great product,Super,0,great product super
67,67,,Good quality product,Very nice product 😊👍Fastest delivery 🚚Installation and demo done by very next day 👍👍,0,good qualiti product nice product fastest deliveri instal demo next day
68,68,,Simply awesome,"Bazel less slim ,samsung is master of good disply  picture quality is really excellent, connectivity is also good .Really satisfied with the purchase also quick delivery by flipkart delivery partner.",0,simpli awesom bazel less slim samsung master good displi pictur qualiti realli excel connect also good realli satisfi purchas also quick deliveri flipkart deliveri partner
69,69,,Terrific,Fabulous product 😘😘There is some delay  on product delivery...Overall the product is good and product quality is also good product delivery in good condition ...Fully satisfied with this product...Value of money....Thanks to flipkart😘✌️,0,terrif fabul product delay product deliveryoveral product good product qualiti also good product deliveri good condit fulli satisfi productvalu mythank flipkart
70,70,,Pretty good,It is good product in reasonable price.,0,pretti good good product reason price
71,71,,Good quality product,Sound quality is good. Display is super. They always maintain the quality. Value for money. As speaker given in bottom it is suitable for wall mounting only,0,good qualiti product sound qualiti good display super alway maintain qualiti valu speaker given bottom suitabl wall mount
72,72,,Delightful,Nice tv,0,delight nice tv
73,73,,Terrific,Amazing picture quality and superb connectivity.. sound good as well.. one flause I found is it does not have bluetooth.. sadly? overall good value for money...,0,terrif amaz pictur qualiti superb connect sound good well flaus found bluetooth sad overal good valu
74,74,,Best in the market!,Picture quality so good...must buy...just go for it 🤗,0,best market pictur qualiti goodmust buyjust go
75,75,,Classy product,Verry good smart TV with this range.installation person come on given time but tv delivery is 3 days late on given time.overall tv is very good,0,classi product verri good smart tv rangeinstal person come given time tv deliveri day late given timeoveral tv good
76,76,,Fabulous!,Nyc product,0,fabul nyc product
77,77,,Worth every penny,Good pictures quality and good 👍sound quality...,0,worth everi penni good pictur qualiti good sound qualiti
78,78,,Wonderful,Nice 👍,0,wonder nice
79,79,,Highly recommended,Good 👍,0,high recommend good
80,80,,Simply awesome,Very very good product good picture Colette,0,simpli awesom good product good pictur colett
81,81,,Wonderful,"Picture quality awesome, sound quality very good. Don't purchase other brand. Samsung is best choice.",0,wonder pictur qualiti awesom sound qualiti good dont purchas brand samsung best choic
82,82,,Excellent,Nice and awesome thank Flipkart for such a great deal thank u Samsung,0,excel nice awesom thank flipkart great deal thank u samsung
83,83,,Classy product,Awesome product from samsung and negative is  less no of ports,0,classi product awesom product samsung negat less port
84,84,,Pretty good,Worth,0,pretti good worth
85,85,,Delightful,Looking nice. Writing this review after 3 days of buying. I have not connected wireless keyboard and mouse yet.,0,delight look nice write review day buy connect wireless keyboard mous yet
86,86,,Simply awesome,Nice experience....value for money!!,0,simpli awesom nice experiencevalu
87,87,,Wonderful,Fully Satisfied this Tv,0,wonder fulli satisfi tv
88,88,,Perfect product!,Super design,0,perfect product super design
89,89,,Awesome,Great Quality And Superfast Installation Service from Samsung,0,awesom great qualiti superfast instal servic samsung
